{
  "company": {
    "name": "BrightDesk",
    "website": "brightdesk.example"
  },
  "contact": {
    "name": "Анна",
    "role": "Marketing Lead",
    "email": "anna@brightdesk.example",
    "telegram": "@annabdesk"
  },
  "current_state": "Есть базовая аналитика, но нет стабильной performance-стратегии.",
  "service_interest": "Mixed",
  "market": "DACH",
  "urgency": "2–4 weeks",
  "budget_range": {
    "text": "Около 8-12k EUR в месяц",
    "currency": "EUR",
    "min": 8000,
    "max": 12000,
    "confidence": 82,
    "evidence": "8-12k EUR"
  },
  "pain_points": [
    "Нестабильный CPL",
    "Слабая сквозная аналитика"
  ],
  "ai_summary": "Компания из DACH ищет смешанный пакет по performance и analytics с запуском в ближайшие 2–4 недели.",
  "ai_confidence_overall": 86,
  "ai_questions": [
    "Какие каналы у вас приоритетны в DACH?",
    "Какой целевой CPL или ROAS вы хотите достичь?",
    "Кто принимает финальное решение по бюджету?"
  ],
  "needs_contact": true,
  "language_detected": "ru"
}
